{
  "allowed_method_ids": [
    "bsgs_v1",
    "ordinary_rho_xmod3_v1"
  ],
  "authorization_id": null,
  "budgets": {
    "max_field_bits": 32,
    "max_group_law_invocations": 100000,
    "max_memory_bytes": 67108864,
    "max_steps": 100000,
    "max_subgroup_order_bits": 32,
    "max_table_entries": 65536,
    "timeout_ns": 5000000000,
    "workers": 1
  },
  "campaign_id": "730bee5abac7016810134755c27c014e5d47bf5c141d96044f4e0930875b30a8",
  "candidate_id": null,
  "contract_kind": "campaign_config_v1",
  "expected_work_unit_count": 2,
  "framework_authorization_class": "fixture",
  "hypothesis_id": null,
  "internal_classification": "engineering_only",
  "matrix": {
    "algorithm_seeds": [
      7
    ],
    "curve_catalog_sha256s": [
      "d293afa7e5b614f39ed00356e35ee81a400b57ee9656907170193cb3aca0bbd7"
    ],
    "curve_fixture_ids": [
      "toy-secp-j0-b13-c0-p5923"
    ],
    "method_ids": [
      "bsgs_v1",
      "ordinary_rho_xmod3_v1"
    ],
    "repetitions": 1,
    "target_vector_sha256s": [
      "f530af54bbc7c68523bef1abcf97853d7c635244c15f5c071f91857ecf8083d8"
    ]
  },
  "native_research_outcome": false,
  "provenance": {
    "config_sha256": "730bee5abac7016810134755c27c014e5d47bf5c141d96044f4e0930875b30a8",
    "diff_sha256": "49e8d1e688dd93e3d13c194c150de18e29165f1472e9bc9edf17d453843edc5a",
    "producer_dependency_sha256s": [
      "159d4ae6ca80698c1fe0baaeb8df4fcba7d8bc0782a01012699e492aa31eda3b"
    ],
    "source_commit": "1aba9f025950af687d9a0e5104c8642e018aeb2e",
    "source_snapshot_sha256": "6b1de837e5981602259bcfd00d48fd2eee30253851422f86c93151cfd5da76fa",
    "source_tree_clean": false,
    "validator_dependency_sha256s": [
      "ffce28ae3a194429bbb8a068d7bb8e4048fdc99321c85f1f34edca5e4d859bad"
    ]
  },
  "record_kind": "lab_engineering_fixture",
  "retainable": false,
  "retention_class": "engineering_only",
  "route_effect": "none",
  "schema_version": 1
}
